{
  "$schema": "https://json-schema.org/draft/2020-12/schema",
  "$id": "https://github.com/zeeshan8281/arena-router/results/schema/run.schema.json",
  "title": "Arena run result",
  "description": "Per-run results file (spec §7.1). Emitted by competition/scoring/results.mjs buildRunResult().",
  "type": "object",
  "required": ["schema_version", "run_id", "run_type", "author", "trials", "median_pass_count", "median_billed_usd", "validity"],
  "additionalProperties": true,
  "properties": {
    "schema_version": { "const": 1 },
    "run_id": { "type": "string", "description": "pr<n>-<smoke|full|baseline>-a<attempt>" },
    "run_type": { "enum": ["smoke", "full", "baseline"] },
    "pr": { "type": ["integer", "string", "null"] },
    "author": { "type": "string" },
    "entry_name": { "type": ["string", "null"] },
    "submission_sha": { "type": ["string", "null"] },
    "pi_version": { "type": ["string", "null"] },
    "config_sha": { "type": ["string", "null"] },
    "started_at": { "type": ["string", "null"] },
    "finished_at": { "type": ["string", "null"] },
    "trials": {
      "type": "array",
      "items": {
        "type": "object",
        "required": ["pass_count", "billed_usd"],
        "properties": {
          "pass_vector": { "type": "object", "additionalProperties": { "type": "boolean" } },
          "pass_count": { "type": "integer", "minimum": 0 },
          "n_errors": { "type": "integer", "minimum": 0 },
          "billed_usd": { "type": "number", "minimum": 0, "description": "OpenRouter ledger delta for this trial" },
          "generation_ids": { "type": "array", "items": { "type": "string" }, "description": "ledger audit trail (§7.1)" },
          "input_tokens": { "type": "integer", "minimum": 0 },
          "output_tokens": { "type": "integer", "minimum": 0 },
          "cache_read_tokens": { "type": "integer", "minimum": 0 }
        }
      }
    },
    "median_pass_count": { "type": "number", "minimum": 0 },
    "median_billed_usd": { "type": "number", "minimum": 0 },
    "openrouter_key_name": { "type": "string", "description": "the minted key's name; equals run_id" },
    "validity": {
      "type": "object",
      "properties": {
        "byok_zero": { "type": "boolean", "description": "byok_usage == 0 (§6.1.6)" },
        "models_allowlisted": { "type": "boolean", "description": "every generation record's model ∈ allowlist" },
        "post_teardown_records": { "type": "boolean", "description": "late records after key deletion (§6.1.7)" },
        "voided": { "type": "boolean" },
        "void_reason": {}
      }
    },
    "anomaly_flags": { "type": "array" },
    "smoke_gate": { "type": "object" }
  }
}
